no,nombre_del_museo,telefono_fijo,celular,correo_electrãnico,pagina_web,direccion,localidad,upz,nombre_de_la_entidad_administradora_del_equipamiento,ano_inicio,caracter,del_orden,uso_principal
112,BIBLIOTECA COLEGIO DISTRITAL RESTREPO MILLÁN SEDE C PESEBRE,2053030,N.D,N.D,http://www.educacionbogota.edu.co/,AK 14 38 02 SUR,RAFAEL URIBE URIBE,MARCO FIDEL SUAREZ,SECRETARÍA DISTRITAL DE EDUCACIÓN,1995,PÚBLICO,DISTRITAL,Biblioteca
118,BIBLIOTECA COMUNITARIA MOLINOS II,7311513,N.D,N.D,http://www.integracionsocial.gov.co/,CL 48P BIS SUR 5 10,RAFAEL URIBE URIBE,DIANA TURBAY,SECRETARÍA DISTRITAL DE INTEGRACIÓN SOCIAL,1989,PÚBLICO,DISTRITAL,Biblioteca
28,BIBLIOTECA POPULAR EL UVAL,N.D,3115830918,bibliotecauval@gmail.com,N.D,VEREDA EL UVAL FINCA EL BALCÓN,USME,CIUDAD USME,BIBLIOTECA POPULAR EL UVAL,N.D,PRIVADA,,Biblioteca
89,BIBLIOTECA COMUNITARIA LA ESTRELLA,7659967,N.D,N.D,N.D,KR 18B 73 09 SUR,CIUDAD BOLÍVAR,LUCERO,BIBLIOTECA COMUNITARIA LA ESTRELLA,N.D,PRIVADA,,Biblioteca
26,BIBLIOTECA PÚBLICA LA MARICHUELA,2000046 - 7647750,3187898330,promomarichuela@biblored.edu.co,N.D,DG 76B SUR 1C 40 SUR,USME,GRAN YOMASA,SECRETARÍA DISTRITAL DE EDUCACIÓN,2001,PÚBLICO,DISTRITAL,Biblioteca
95,BIBLIOTECA COMUNITARIA IAP CUYEJEYECA JOCCHOGÜE (LA PUERTA MAGICA),7194733,3142302744,CUYEKA@GMAIL.COM,http://www.cuyeca.org/,TV 73D BIS A 68 36,CIUDAD BOLÍVAR,ISMAEL PERDOMO,CORPORACIÓN COMUNITARIA CUYECA A OBSUN (MANOJO DE SEMILLAS),2001,PRIVADA,,Biblioteca
22,BIBLIOTECA COMUNITARIA LOS FUNDADORES,3371748,N.D,N.D,N.D,KR 7 ESTE 8 58 SUR,SAN CRISTÓBAL,SOSIEGO,BIBLIOTECA COMUNITARIA LOS FUNDADORES,N.D,PRIVADA,,Biblioteca
72,BIBLIOTECA COMUNITARIA MANOS DE CRISTAL,N.D,N.D,N.D,N.D,CL 143 150A 04,SUBA,TIBABUYES,BIBLIOTECA COMUNITARIA MANOS DE CRISTAL,N.D,PRIVADA,,Biblioteca
81,BIBLIOTECA PÚBLICA CARLOS E RESTREPO,3790164 EXT 6020,3125864544,biblorestrepo@biblored.edu.co,http://www.biblored.gov.co/biblioteca-restrepo,TV 21A 19 54 SUR,ANTONIO NARIÑO,RESTREPO,RED CAPITAL DE BIBLIOTECAS PUBLICAS  BIBLORED,2003,PÚBLICO,LOCAL,Biblioteca
37,BIBLIOTECA COMUNITARIA ALAMEDA EL PORVENIR II,6462333 EXT 218,3125522778,Dmora@arfundacion.org,N.D,CL 55 SUR 104 49,BOSA,EL PORVENIR,BIBLIOTECA COMUNITARIA ALAMEDA EL PORVENIR II,N.D,PRIVADA,,Biblioteca
29,BIBLIOTECA COMUNITARIA ASOCIACIÓN PRIMAVERA,7627620,N.D,N.D,N.D,CL 94A SUR 4F 20 ESTE,USME,COMUNEROS,BIBLIOTECA COMUNITARIA ASOCIACIÓN PRIMAVERA,N.D,PRIVADA,,Biblioteca
110,BIBLIOTECA COMUNITARIA VÍA LIBRE,2478038,N.D,rortiz@integracionsocial.gov.co,N.D,KR 35 10 69,PUENTE ARANDA,ZONA INDUSTRIAL,BIBLIOTECA COMUNITARIA VÍA LIBRE,N.D,PRIVADA,,Biblioteca
25,BIBLIOTECA COLEGIO DISTRITAL ALMIRANTE PADILLA SEDE B,7272634,N.D,N.D,http://www.educacionbogota.edu.co/,KR 1C ESTE 76A 21 SUR,USME,GRAN YOMASA,SECRETARÍA DISTRITAL DE EDUCACIÓN,N.D,PÚBLICO,DISTRITAL,Biblioteca
54,BIBLIOTECA COMUNITARIA ATHENEA,5486338,N.D,N.D,N.D,CL 17C 134 70,FONTIBÓN,FONTIBON SAN PABLO,BIBLIOTECA COMUNITARIA ATHENEA,N.D,PRIVADA,,Biblioteca
106,COLEGIO DISTRITAL AGUSTÍN NIETO CABALLERO I.E.D,2375672,3214422509,lnalagustinnietoca14@redf.edu.co,http://www.colagustinnietocaballero.edu.co/,KR 19 11 17,LOS MÁRTIRES,LA SABANA,SECRETARÍA DISTRITAL DE EDUCACIÓN,1974,PÚBLICO,DISTRITAL,Biblioteca
